                                                *************AddressBook System*********************
                                               
//UC1 Creating database as AddessBookService

mysql>create database AddressBookService;
Query OK, 1 row affected (0.32 sec)

mysql> show databases;
+--------------------+
| Database           |
+--------------------+
| addressbookservice |
| archanadb          |
| information_schema |
| mysql              |
| payroll_service    |
| performance_schema |
| sakila             |
| student            |
| sys                |
| world              |
+--------------------+
10 rows in set (0.05 sec)

mysql> use addressbookservice;
Database changed

-------------------------------------------------------------------------------------------------------------------------------------
//UC2 Creating table as AddressBook with attributes

mysql> create table AddressBook(
    -> firstname varchar(50) not null,
    -> lastname varchar(50) not null,
    -> address varchar(100) not null,
    -> city varchar(50) not null,
    -> state varchar(50) not null,
    -> zip int not null,
    -> phonenumber double not null,
    -> email varchar(100) not null);
Query OK, 0 rows affected (2.29 sec)

mysql> desc AddressBook;
+-------------+--------------+------+-----+---------+-------+
| Field       | Type         | Null | Key | Default | Extra |
+-------------+--------------+------+-----+---------+-------+
| firstname   | varchar(50)  | NO   |     | NULL    |       |
| lastname    | varchar(50)  | NO   |     | NULL    |       |
| address     | varchar(100) | NO   |     | NULL    |       |
| city        | varchar(50)  | NO   |     | NULL    |       |
| state       | varchar(50)  | NO   |     | NULL    |       |
| zip         | int          | NO   |     | NULL    |       |
| phonenumber | double       | NO   |     | NULL    |       |
| email       | varchar(100) | NO   |     | NULL    |       |
+-------------+--------------+------+-----+---------+-------+
8 rows in set (0.13 sec)

------------------------------------------------------------------------------------------------------------------------------------

//UC3 inserting new Contacts to AddressBook table

mysql> insert into AddressBook(firstname,lastname,address,city,state,zip,phonenumber,email) values('archana','gowda','puttur','managlore','karnataka',574328,917760973591,'archanar@gmail.com');
Query OK, 1 row affected (0.55 sec)

mysql> insert into AddressBook(firstname,lastname,address,city,state,zip,phonenumber,email) values('soupz','konkani','udupi','kundapur','mp',57878,9199999999,'soupz@gmail.com');
Query OK, 1 row affected (0.62 sec)

mysql> insert into AddressBook(firstname,lastname,address,city,state,zip,phonenumber,email) values('prathik','shetty','nrpura','chikmangalore','kerala',58767,9189765498,'prathik@gmail.com');
Query OK, 1 row affected (0.15 sec)

mysql> insert into AddressBook(firstname,lastname,address,city,state,zip,phonenumber,email) values('jayanth','parmar','indore','abcd','pune',59876,918765456,'jayanth@gmail.com');
Query OK, 1 row affected (2.58 sec)

mysql> select * from AddressBook;
+-----------+----------+---------+---------------+-----------+--------+--------------+--------------------+
| firstname | lastname | address | city          | state     | zip    | phonenumber  | email              |
+-----------+----------+---------+---------------+-----------+--------+--------------+--------------------+
| archana   | gowda    | puttur  | managlore     | karnataka | 574328 | 917760973591 | archanar@gmail.com |
| soupz     | konkani  | udupi   | kundapur      | mp        |  57878 |   9199999999 | soupz@gmail.com    |
| prathik   | shetty   | nrpura  | chikmangalore | kerala    |  58767 |   9189765498 | prathik@gmail.com  |
| jayanth   | parmar   | indore  | abcd          | pune      |  59876 |    918765456 | jayanth@gmail.com  |
+-----------+----------+---------+---------------+-----------+--------+--------------+--------------------+
4 rows in set (0.00 sec)

--------------------------------------------------------------------------------------------------------------------------------------------------------------------

//UC4 editing the existing contact by their firstname

mysql>  update Addressbook set lastname='gowd' where firstname='archana';
Query OK, 1 row affected (0.74 sec)
Rows matched: 1  Changed: 1  Warnings: 0

mysql> select * from Addressbook;
+-----------+----------+---------+---------------+-----------+--------+--------------+--------------------+
| firstname | lastname | address | city          | state     | zip    | phonenumber  | email              |
+-----------+----------+---------+---------------+-----------+--------+--------------+--------------------+
| archana   | gowd     | puttur  | managlore     | karnataka | 574328 | 917760973591 | archanar@gmail.com |
| soupz     | konkani  | udupi   | kundapur      | mp        |  57878 |   9199999999 | soupz@gmail.com    |
| prathik   | shetty   | nrpura  | chikmangalore | kerala    |  58767 |   9189765498 | prathik@gmail.com  |
| jayanth   | parmar   | indore  | abcd          | pune      |  59876 |    918765456 | jayanth@gmail.com  |
+-----------+----------+---------+---------------+-----------+--------+--------------+--------------------+
4 rows in set (0.03 sec)

--------------------------------------------------------------------------------------------------------------------------------------
UC5 -deleting the contact by their lastname

mysql> delete from Addressbook where lastname='parmar';
Query OK, 1 row affected (0.44 sec)

mysql> select * from Addressbook;
+-----------+----------+---------+---------------+-----------+--------+--------------+--------------------+
| firstname | lastname | address | city          | state     | zip    | phonenumber  | email              |
+-----------+----------+---------+---------------+-----------+--------+--------------+--------------------+
| archana   | gowd     | puttur  | managlore     | karnataka | 574328 | 917760973591 | archanar@gmail.com |
| soupz     | konkani  | udupi   | kundapur      | mp        |  57878 |   9199999999 | soupz@gmail.com    |
| prathik   | shetty   | nrpura  | chikmangalore | kerala    |  58767 |   9189765498 | prathik@gmail.com  |
+-----------+----------+---------+---------------+-----------+--------+--------------+--------------------+
3 rows in set (0.01 sec)

-------------------------------------------------------------------------------------------------------------------------------------------------

// UC6 retrieving the contact by city or state

mysql> select * from Addressbook where city='kundapur' or state='kerala';
+-----------+----------+---------+---------------+--------+-------+-------------+-------------------+
| firstname | lastname | address | city          | state  | zip   | phonenumber | email             |
+-----------+----------+---------+---------------+--------+-------+-------------+-------------------+
| soupz     | konkani  | udupi   | kundapur      | mp     | 57878 |  9199999999 | soupz@gmail.com   |
| prathik   | shetty   | nrpura  | chikmangalore | kerala | 58767 |  9189765498 | prathik@gmail.com |
+-----------+----------+---------+---------------+--------+-------+-------------+-------------------+
2 rows in set (0.00 sec)

------------------------------------------------------------------------------------------------------------------------------------------------------


